ID,Item ID,Title,Description,Price,Sale Price,Status,Condition,Brand,Model Number,Serial Number,Location,Seller Name,Seller Email,Department,Category,Height,Width,Depth,Weight,Photos Count,Videos Count,Views,Created At,Updated At,Available From,Available Until
cmh7zuvim0003la04uyod2lsi,JQIKQL,"AR North America 2400 PSI Electric Pressure Washer","This AR North America 2400 PSI Electric Pressure Washer is a powerful and efficient cleaning tool perfect for tackling tough outdoor cleaning tasks. Manufactured by AR North America Inc., this pressure washer is designed to deliver high performance and reliability. It features a robust motor that generates up to 2400 PSI, making it ideal for cleaning driveways, decks, and other large surfaces. The unit is compact and easy to maneuver, ensuring convenience during use.",139.99,,sold,,AR North America,1806269,,,Alex MacDonald,alex.macdonald@treasurehub.club,Patio & Garden,Outdoor Power Equipment,24,24,24,,0,0,0,Sun Oct 26 2025 12:40:00 GMT-0500 (Central Daylight Time),Sun Oct 26 2025 12:41:05 GMT-0500 (Central Daylight Time),,
cmgyj1nhb001bju049rrpf8hh,9U1R33,"Zesthome 8x10 Modern Abstract Area Rug with Non-Slip Backing","Enhance your living space with the zesthome 8x10 Area Rug, designed to bring a modern touch to any room. This ultra-thin, large area rug features a contemporary abstract design that complements a variety of decor styles. Crafted with a non-slip backing, it ensures stability and safety, making it ideal for high-traffic areas. The rug is stain-resistant and washable, offering easy maintenance and long-lasting beauty. Perfect for living rooms, bedrooms, or any space that needs a stylish upgrade.",59.99,,active,,zesthome,,,,Alex MacDonald,alex.macdonald@treasurehub.club,Home Goods,Furniture,0.5,96,120,,0,0,1,Sun Oct 19 2025 21:39:27 GMT-0500 (Central Daylight Time),Sun Oct 19 2025 21:40:03 GMT-0500 (Central Daylight Time),,
cmgyj13db0016ju041rai042f,LZYC1L,"DTICON Washable Boho Vintage Distressed 5x7 Rug - Camel","Enhance your living space with the DTICON Washable Boho Vintage Distressed Rug. This 5x7 area rug features a beautiful oriental medallion design in a neutral camel color, perfect for adding a touch of elegance to any room. Ideal for living rooms, bedrooms, dining rooms, or home offices, this thin rug carpet is both stylish and practical. Made from durable materials, it is easy to clean and maintain, ensuring it remains a staple in your home decor for years to come.",34.99,,active,,DTICON,,,,Alex MacDonald,alex.macdonald@treasurehub.club,Home Goods,Furniture,0.5,60,84,,0,0,1,Sun Oct 19 2025 21:39:01 GMT-0500 (Central Daylight Time),Sun Oct 19 2025 21:39:42 GMT-0500 (Central Daylight Time),,
cmgyitm0t000qjs045867a7kr,8WN3JB,"Lascpt Super Soft Shag Area Rug, 4x6 ft Navy Blue","Enhance your living space with the Lascpt Super Soft Shag Area Rug. This 4x6 ft navy blue rug is designed to add a touch of modern elegance to any room. Perfect for a girl's bedroom, kids' room, or nursery, this plush throw rug offers a fuzzy and comfortable surface that is ideal for indoor use. Whether you're decorating a dorm, office, or home, this rug is a versatile addition to your decor. Made from high-quality materials, it provides a soft and luxurious feel underfoot, making it a great choice for women looking to add a stylish touch to their home.",30,,active,,Lascpt,,,,Alex MacDonald,alex.macdonald@treasurehub.club,Home Goods,Home Decor,0.5,48,72,,0,0,3,Sun Oct 19 2025 21:33:12 GMT-0500 (Central Daylight Time),Tue Oct 21 2025 04:08:39 GMT-0500 (Central Daylight Time),,
cmgyij2di000ljs04v7tlj9pe,YLKOZ3,"HILORUUG 3x8 Runner Rug - Ivory, Non-Slip, Washable","Enhance your home's aesthetic with the HILORUUG 3x8 Runner Rug, perfect for kitchens, hallways, and entryways. This elegant ivory runner features a soft, low-pile design that is both stain-resistant and easy to clean, making it ideal for high-traffic areas. Its non-slip backing ensures safety, while the oriental pattern adds a touch of sophistication to any space. Crafted for durability and style, this rug is a versatile addition to your home decor.",39.99,,active,,HILORUUG,,,,Alex MacDonald,alex.macdonald@treasurehub.club,Home Goods,Home Decor,.5,36,96,,0,0,2,Sun Oct 19 2025 21:25:00 GMT-0500 (Central Daylight Time),Mon Nov 03 2025 14:03:56 GMT-0600 (Central Standard Time),,
cmgyiidll0010ju04z3guk5nw,3LL9S3,"ChenXRug Pink Leopard Bath Mat - Non-Slip Animal Shaped","Add a playful touch to your bathroom with the ChenXRug Pink Leopard Bath Mat. This adorable pink cartoon leopard-shaped rug is perfect for kids and adults alike, providing a fun and functional addition to your bathroom decor. Made from absorbent materials, it ensures your floors stay dry while offering a soft surface to step on after a shower. The non-slip backing keeps the mat securely in place, preventing slips and falls. Ideal for use as a bath mat or a kid's playmat, this versatile rug is both practical and stylish.",19.99,,active,,ChenXRug,,,,Alex MacDonald,alex.macdonald@treasurehub.club,Home Goods,Bath Products,.5,39,24,,0,0,5,Sun Oct 19 2025 21:24:27 GMT-0500 (Central Daylight Time),Thu Oct 23 2025 15:31:34 GMT-0500 (Central Daylight Time),,
cmgyi9ooo000gjs04o9h7uzag,ATIZ1Y,"Rugsjwaizj Machine Washable Rainbow Rug 3x4ft","Enhance your living space with the Rugsjwaizj Machine Washable Rainbow Rug. This vibrant and fluffy area rug features a rainbow sunshine sun print, making it a perfect addition to any bedroom or living room. Designed for both kids and adults, this non-slip indoor flooring solution is not only aesthetically pleasing but also practical. The rug is machine washable, ensuring easy maintenance and long-lasting beauty. Its plush texture offers a soft and comfortable feel underfoot, making it ideal for playtime or relaxation.",35,,active,,Rugsjwaizj,,,,Alex MacDonald,alex.macdonald@treasurehub.club,Home Goods,Home Decor,.5,36,48,,0,0,2,Sun Oct 19 2025 21:17:42 GMT-0500 (Central Daylight Time),Sun Oct 19 2025 21:18:23 GMT-0500 (Central Daylight Time),,
cmgyi1u02000bjs04wiq0w96b,QOVUT0,"Greymond Upholstered Wall Mounted Headboard, Dark Grey, 4-Pack","Enhance your living space with the Greymond Upholstered Wall Mounted Headboard, a versatile and stylish addition to any bedroom. This 4-pack of acoustic panels is designed to provide both aesthetic appeal and functional soundproofing. Each panel is covered in a luxurious dark grey dorm towel fabric, offering a sophisticated look that complements a variety of interior styles. The peel and stick design ensures easy installation, allowing you to effortlessly transform your space. Ideal for dorm rooms, apartments, or any room in need of a modern touch.",35,,active,,Greymond,,,,Alex MacDonald,alex.macdonald@treasurehub.club,Furniture,Bedroom,10,24,1,,0,0,1,Sun Oct 19 2025 21:11:36 GMT-0500 (Central Daylight Time),Sun Oct 19 2025 21:12:09 GMT-0500 (Central Daylight Time),,
cmgyhidd3000vju04uc3p04y7,WA1NFO,"Zaowofires Solid Wood Step Stool, Walnut Finish","The Zaowofires Solid Wood Step Stool is a versatile and stylish addition to any home. Crafted from high-quality solid wood, this step stool offers durability and a classic walnut finish that complements any decor. Its compact size makes it perfect for use as a plant stand, footstool, or shoe changing stool. The stool's removable and portable design ensures easy storage and transport, making it a practical choice for various household tasks.",19.99,,active,,Zaowofires,,,,Alex MacDonald,alex.macdonald@treasurehub.club,Home Goods,Furniture,9.3,9.3,9.3,,0,0,1,Sun Oct 19 2025 20:56:28 GMT-0500 (Central Daylight Time),Sun Oct 19 2025 20:56:46 GMT-0500 (Central Daylight Time),,
cmgyhdnjr000qju04mi4p76f9,IFMAF0,"TQUEG 3-Level Height Adjustable Kids Chair, Beige","This TQUEG 3-Level Height Adjustable Kids Chair is perfect for day care, classroom, and home use. Made from durable plastic, it is lightweight yet sturdy, with a maximum load capacity of 130 pounds. The chair is designed to grow with your child, featuring three adjustable height levels to accommodate different ages and sizes. Its beige color blends seamlessly with any decor, making it a versatile addition to any space.",19.99,,active,,TQUEG,LPNPMDL0921445,,,Alex MacDonald,alex.macdonald@treasurehub.club,Home Goods,Furniture,19,14,10,,0,0,1,Sun Oct 19 2025 20:52:47 GMT-0500 (Central Daylight Time),Sun Oct 19 2025 20:53:03 GMT-0500 (Central Daylight Time),,
cmgyh72bc0001jv04nwx4b9jx,LZS9LI,"IRONDIY 6 Pcs Bed Frame Feet - Plastic Reinforced Bed Risers","Upgrade your bed frame with the IRONDIY 6 Pcs Bed Frame Feet. Designed to replace wheels and prevent sliding, these reinforced plastic bed risers fit over standard bed feet, providing stability and durability. Ideal for those looking to enhance their bed's support and prevent unwanted movement. Perfect for any bedroom setup, these risers are easy to install and offer a reliable solution for maintaining your bed's position.",6.99,,active,,IRONDIY,,,,Alex MacDonald,alex.macdonald@treasurehub.club,Home Goods,Furniture,4,2.5,2.5,,0,0,1,Sun Oct 19 2025 20:47:40 GMT-0500 (Central Daylight Time),Sun Oct 19 2025 20:48:07 GMT-0500 (Central Daylight Time),,
cmgyh3ytt000lju04wqjfsqea,E3GCHS,"OLNGYUE 12""x24"" Stainless Steel Bathroom Shower Niche Shelf","Enhance your bathroom decor with the OLNGYUE 12""x24"" Bathroom Shower Niche Shelf. This double-layer stainless steel shelf offers a sleek and modern solution for organizing your shower essentials. Designed for easy installation, it requires no tile work, making it a convenient choice for any home renovation project. The brushed nickel finish adds a touch of elegance, ensuring it complements a variety of bathroom styles. Perfect for storing shampoos, soaps, and other toiletries, this recessed wall niche box is both functional and stylish.",99.95,,active,,OLNGYUE,LPNPMEG3335910,,,Alex MacDonald,alex.macdonald@treasurehub.club,Home Goods,Storage & Organization,12.3,24.2,3.6,,0,0,3,Sun Oct 19 2025 20:45:16 GMT-0500 (Central Daylight Time),Sun Oct 19 2025 20:49:15 GMT-0500 (Central Daylight Time),,
cmgyguavk000gju04tgv4iliy,JEM7YA,"TRUEDAYS 5x7 Washable Pink Area Rug with Non-Slip Backing","Enhance your living space with the TRUEDAYS Area Rug, a modern abstract design in a soft pink hue. Measuring 5x7 feet, this rug is perfect for entryways, college dorms, living rooms, and bedrooms. Its low pile construction ensures easy maintenance, while the non-slip backing provides safety and stability on any floor surface. Ideal for adding a touch of elegance to your home décor, this rug combines style with functionality.",35,,active,,TRUEDAYS,,,,Alex MacDonald,alex.macdonald@treasurehub.club,Home Goods,Home Decor,0.5,60,84,,0,0,3,Sun Oct 19 2025 20:37:44 GMT-0500 (Central Daylight Time),Sat Oct 25 2025 16:57:47 GMT-0500 (Central Daylight Time),,
cmgygnujm000bju04z73j201k,R28944,"JANUS LiANG 3-Tier Rose Gold Bathroom Counter Organizer","Enhance your bathroom's organization with the JANUS LiANG 3-Tier Bathroom Counter Organizer. This elegant rose gold organizer is designed to maximize your countertop space while adding a touch of sophistication to your decor. Ideal for storing makeup, skincare products, and perfumes, this organizer is both functional and stylish. Its corner design allows it to fit snugly on your vanity, making it a perfect addition to any bathroom setup.",18.99,,sold,,JANUS LiANG,,,,Alex MacDonald,alex.macdonald@treasurehub.club,Home Goods,Storage & Organization,17.5,7.3,7.3,,0,0,2,Sun Oct 19 2025 20:32:43 GMT-0500 (Central Daylight Time),Sun Nov 02 2025 20:28:13 GMT-0600 (Central Standard Time),,
cmgygn9ly0006js0430wa7fo2,V3515H,"LUE BONA HDPS Shower Bench Seat, Navy Blue","The LUE BONA HDPS Shower Bench Seat is a versatile and stylish addition to any bathroom or outdoor space. Designed for both indoor and outdoor use, this non-slip shower stool provides a safe and comfortable seating option. Crafted with a weather-resistant finish, it is perfect for use in wet environments. The bench features a convenient storage shelf, making it ideal for keeping bath essentials within reach. Its navy blue color adds a touch of elegance, while the sturdy construction ensures durability and stability.",45,,active,,LUE BONA,,,,Alex MacDonald,alex.macdonald@treasurehub.club,Home Goods,Bath Products,17.5,16.3,12.6,,0,0,1,Sun Oct 19 2025 20:32:16 GMT-0500 (Central Daylight Time),Sun Oct 19 2025 20:33:04 GMT-0500 (Central Daylight Time),,
cmgyg2uy60001js04ej37yyiq,BM9JCI,"BRIAN & DANY Small Velvet Foot Stool, Green","The BRIAN & DANY Small Foot Stool is a versatile and stylish addition to any living room. Crafted with a luxurious velvet finish, this green footstool offers both comfort and stability, making it perfect for resting your feet or providing extra seating. Its compact design ensures it fits seamlessly into any space, while the sturdy legs guarantee durability. Ideal for modern and classic interiors alike, this footstool combines functionality with aesthetic appeal.",35.99,,active,,BRIAN & DANY,,,,Alex MacDonald,alex.macdonald@treasurehub.club,Home Goods,Furniture,9,15.5,11.5,,0,0,1,Sun Oct 19 2025 20:16:24 GMT-0500 (Central Daylight Time),Sun Oct 19 2025 20:18:25 GMT-0500 (Central Daylight Time),,
cmgyg2aq10006ju04yvkgub9z,3P4AKS,"AEHISDHIE Waterproof Rug Pad 9x12 ft Non-Slip Carpet Pad","Enhance the safety and longevity of your rugs with the AEHISDHIE Waterproof Rug Pad. Measuring 9x12 feet, this non-slip carpet pad is designed to keep your rugs securely in place on all floor types, including hardwood. Made from high-quality felt, it provides a soft and safe surface, preventing slips and falls while protecting your floors from scratches and wear. Ideal for any room in your home, this rug pad is both functional and durable, ensuring your rugs stay in place and look great for years to come.",75,,active,,AEHISDHIE,,,,Alex MacDonald,alex.macdonald@treasurehub.club,Home Goods,Home Decor,0.2,108,144,,0,0,1,Sun Oct 19 2025 20:15:58 GMT-0500 (Central Daylight Time),Sun Oct 19 2025 20:17:37 GMT-0500 (Central Daylight Time),,
cmgyfnplp0001ju04kyu53s00,ALFLLS,"LOONGRUG 9x12 Washable Boho Area Rug - Ivory Gray","Enhance your living space with the LOONGRUG 9x12 Area Rug, designed for both style and practicality. This large, washable rug features a boho-inspired design in neutral ivory and gray tones, perfect for adding a touch of elegance to any room. Its stain-resistant and non-slip properties make it ideal for high-traffic areas such as living rooms, bedrooms, and dining rooms. Crafted for durability, this rug is soft to the touch, providing comfort underfoot for you and your family.",165,,active,,LOONGRUG,,,,Alex MacDonald,alex.macdonald@treasurehub.club,Home Goods,Furniture,0.5,108,144,,0,0,2,Sun Oct 19 2025 20:04:37 GMT-0500 (Central Daylight Time),Tue Nov 04 2025 10:41:48 GMT-0600 (Central Standard Time),,
cmgycsac60001l104eeg7rnvm,ZCZHS3,"Lahome Oriental Small Rug 2x3 Non Slip Washable","Enhance your home décor with the Lahome Oriental Small Rug, designed for versatility and style. This 2x3 rug is perfect for entryways, kitchens, bedrooms, and bathrooms. Its ultra-thin design ensures it fits seamlessly under doors, while the non-slip backing keeps it securely in place. The vintage-inspired pattern in green and multi-color adds a touch of elegance to any space. Made from soft, durable materials, this rug is also washable, making it easy to maintain its beauty over time.",19.99,,active,,Lahome,,,,Alex MacDonald,alex.macdonald@treasurehub.club,Home Goods,Home Decor,.5,24,36,,0,0,1,Sun Oct 19 2025 18:44:12 GMT-0500 (Central Daylight Time),Sun Oct 19 2025 18:45:03 GMT-0500 (Central Daylight Time),,
cmgycm5xp0001jx04f3srn6cm,EMYH6D,"RUGSURE Washable Vintage Tribal Area Rug, Rust, 4' x 6'","Enhance your living space with the RUGSURE Washable Area Rug, designed to bring a touch of vintage charm to any room. This rust-colored rug features a tribal pattern that complements a variety of décor styles, making it perfect for living rooms, bedrooms, kids' rooms, or nurseries. Its stain and water-resistant properties ensure durability, while the non-slip backing provides safety for both pets and children. Measuring 4' x 6', this rug is an ideal size for adding warmth and texture to your floors.",45.59,,active,,RUGSURE,,,,Alex MacDonald,alex.macdonald@treasurehub.club,Home Goods,Home Decor,.5,48,72,,0,0,1,Sun Oct 19 2025 18:39:26 GMT-0500 (Central Daylight Time),Sun Oct 19 2025 18:39:42 GMT-0500 (Central Daylight Time),,
cmgy70z1t000ll404zfe449j2,EIGE07,"DEXDE Boho Bathroom Rugs Runner 20x47 Non Slip Beige","Enhance your bathroom decor with the DEXDE Boho Bathroom Rugs Runner. This luxurious bath mat measures 20x47 inches, offering ample coverage for your bathroom floor. Crafted from plush microfiber, it provides a soft and absorbent surface that feels great underfoot. The non-slip backing ensures the rug stays securely in place, even in high-traffic areas. Designed in a stylish half-circle shape, this rug adds a touch of elegance to any bathroom setting. Its beige color complements a variety of decor styles, making it a versatile addition to your home. Machine washable for easy care, this rug is both practical and stylish, perfect for use in front of tubs and showers.",28.99,,active,,DEXDE,,,,Alex MacDonald,alex.macdonald@treasurehub.club,Home Goods,Bath Products,.5,20,47,,0,0,2,Sun Oct 19 2025 16:03:00 GMT-0500 (Central Daylight Time),Sun Oct 19 2025 18:36:25 GMT-0500 (Central Daylight Time),,
cmgy70hkr0006k104jq6lniyu,BSO95W,"PureCozy Gray Runner Rug 2x12 Machine Washable","The PureCozy Gray Runner Rug is a versatile and stylish addition to any home. Measuring 2x12 feet, this runner rug is perfect for hallways, kitchens, and other high-traffic areas. It features a vintage distressed design with a retro floral pattern, adding a touch of elegance to your space. The rug is machine washable, making it easy to maintain and keep clean. Its non-slip backing ensures safety and stability on various floor types. Ideal for use in the bedroom, bathroom, office, laundry, dining, or living room, this rug combines functionality with aesthetic appeal.",49.99,,active,,PureCozy,,,,Alex MacDonald,alex.macdonald@treasurehub.club,Home Goods,Home Decor,.5,24,120,,0,0,2,Sun Oct 19 2025 16:02:37 GMT-0500 (Central Daylight Time),Sat Oct 25 2025 13:25:33 GMT-0500 (Central Daylight Time),,
cmgy6q2pe0001k104pqx1dy3u,PJ2UPK,"AMOAMI 2x10 Runner Rug - Vintage Beige Washable","Introducing the AMOAMI 2x10 Runner Rug, a perfect blend of style and functionality for your home. This vintage-inspired runner rug is designed to enhance the aesthetic of any hallway, entryway, or bedroom. Crafted with a soft, non-slip backing, it ensures safety and comfort underfoot. The rug is washable, making it easy to maintain and ideal for high-traffic areas like kitchens, bathrooms, and laundry rooms. Its beige color adds a touch of elegance, while the vintage pattern complements a variety of interior styles.",50,,active,,AMOAMI,,,,Alex MacDonald,alex.macdonald@treasurehub.club,Home Goods,Home Decor,.5,24,120,,0,0,1,Sun Oct 19 2025 15:54:31 GMT-0500 (Central Daylight Time),Sun Oct 19 2025 15:54:51 GMT-0500 (Central Daylight Time),,
cmgy6ipqd000gl404qsfhpxbq,M813J7,"CozeCube Blossom Pink Fluffy Shaggy Bath Mat 16"" x 24""","Enhance your bathroom decor with the CozeCube Blossom Pink Fluffy Shaggy Bath Mat. Designed for both style and functionality, this bath mat features a non-slip backing to ensure safety and stability. Made from soft, absorbent microfiber, it provides a plush and comfortable feel underfoot while effectively soaking up water to keep your floors dry. The vibrant pink color adds a touch of elegance and warmth to any bathroom setting. Measuring 16 inches by 24 inches, this bath mat is perfect for placement in front of your shower, sink, or bathtub. Easy to clean and maintain, it's machine washable for your convenience.",14.99,,active,,CozeCube,,,,Alex MacDonald,alex.macdonald@treasurehub.club,Home Goods,Bath Products,.5,16,24,,0,0,1,Sun Oct 19 2025 15:48:48 GMT-0500 (Central Daylight Time),Sun Oct 19 2025 15:49:00 GMT-0500 (Central Daylight Time),,
cmgy6eguq000bl404slx9zux3,O7WEK0,"Tiwwie Fuzzy Sofa Cover for Dogs - Geometric Jacquard Grey","Protect your sofa with the Tiwwie Couch Cover, designed specifically for pet owners. This fuzzy sofa cover features a geometric jacquard pattern in a grey color, offering both style and functionality. Made from pet-friendly materials, it is washable and non-slip, ensuring it stays in place even with active pets. Ideal for protecting your furniture from pet hair, scratches, and spills, this cover doubles as a comfortable mat for your dog. Easy to clean and maintain, it is a must-have for any pet-friendly home.",60,,active,,Tiwwie,,,,Alex MacDonald,alex.macdonald@treasurehub.club,Home Goods,Furniture,.5,28,84,,0,0,1,Sun Oct 19 2025 15:45:30 GMT-0500 (Central Daylight Time),Sun Oct 19 2025 15:46:00 GMT-0500 (Central Daylight Time),,
cmgy655di0006l404cczjj6zj,ORLLTB,"Molain Faux Fur Chair Pad 12 Inch Square Cushion","Enhance your living space with the Molain Faux Fur Chair Pad. This 12-inch square cushion is designed to provide comfort and style to any chair, sofa, or bed. Crafted from soft, fluffy faux fur, it offers a luxurious feel and adds a touch of elegance to your home decor. Ideal for use in the living room, bedroom, or as a photographing background, this versatile cushion is both functional and decorative. The grey color complements a wide range of interior styles, making it a perfect addition to any room.",5.99,,active,,Molain,,,,Alex MacDonald,alex.macdonald@treasurehub.club,Home Goods,Furniture,.5,12,12,,0,0,1,Sun Oct 19 2025 15:38:15 GMT-0500 (Central Daylight Time),Sun Oct 19 2025 15:41:47 GMT-0500 (Central Daylight Time),,
cmgy5va4y000bjj04xygtw72o,MV7HT5,"Yidanamy 5x7 Washable Vintage Area Rug with Non-Slip Backing","Enhance your living space with the Yidanamy 5x7 Area Rug, designed to bring a touch of vintage charm to any room. This large, washable rug features a neutral beige palette, making it a versatile addition to your living room, bedroom, dining room, or nursery. Crafted with a low pile for easy maintenance, it offers a soft and comfortable surface underfoot. The non-slip backing ensures the rug stays securely in place, providing safety and stability. Ideal for farmhouse or modern decor, this rug is both functional and stylish, making it a perfect choice for any home.",79.99,,active,,Yidanamy,,,,Alex MacDonald,alex.macdonald@treasurehub.club,Home Goods,Home Decor,.5,60,84,,0,0,1,Sun Oct 19 2025 15:30:35 GMT-0500 (Central Daylight Time),Sun Oct 19 2025 15:30:49 GMT-0500 (Central Daylight Time),,
cmgy5renn0006jj0494lfl3xp,SGDHQU,"Fame Living Cream Green Oushak Rug, Large Area Rug","Enhance your living space with the Fame Living Cream Green Oushak Rug. This modern yet vintage-inspired Turkish rug features an eclectic floral pattern in pastel hues, making it a versatile addition to any room. Measuring 7'5"" x 9'8"", it is perfect for living rooms, dining areas, or bedrooms. The rug is washable, ensuring easy maintenance and long-lasting beauty. Ideal for both girls and boys' rooms, this rug combines style and practicality.",350,,sold,,Fame Living,,,,Alex MacDonald,alex.macdonald@treasurehub.club,Home Goods,Home Decor,.5,89,116,,0,0,2,Sun Oct 19 2025 15:27:34 GMT-0500 (Central Daylight Time),Sun Oct 26 2025 12:41:45 GMT-0500 (Central Daylight Time),,
cmgy5hf3a0001l404ovukelj5,XQKQOR,"Windkream Fabric Sink Skirt Diamond Bathroom Stitch","Enhance your bathroom's aesthetic and functionality with the Windkream Fabric Sink Skirt. This stylish and practical accessory measures 55 x 32 inches and is designed to add a touch of elegance to your bathroom decor. Made from waterproof fabric, it features a diamond stitch pattern and a self-stick adhesive for easy installation. The skirt is perfect for hiding unsightly plumbing and creating additional storage space under your sink. Its white color and fashion-forward style make it a versatile addition to any bathroom setting.",9.99,,active,,Windkream,,,,Alex MacDonald,alex.macdonald@treasurehub.club,Home Goods,Bath Products,32,55,.1,,0,0,1,Sun Oct 19 2025 15:19:48 GMT-0500 (Central Daylight Time),Sun Oct 19 2025 15:20:00 GMT-0500 (Central Daylight Time),,
cmgy5d3wc0001jj045wvr8j6m,PZO2YV,"AROGAN Luxury Long Bathroom Runner Rug 24x60 Inch Black","Enhance your bathroom with the AROGAN Luxury Long Bathroom Runner Rug, designed for both style and functionality. This 24x60 inch rug is crafted from thick, soft, and absorbent microfiber, providing a plush feel underfoot while effectively absorbing moisture. The non-slip rubber backing ensures the rug stays securely in place, making it a safe choice for your shower floor. Quick-drying and machine washable, this rug offers convenience and ease of maintenance. Its sleek black color adds a touch of elegance to any bathroom decor.",28,,active,,AROGAN,,,,Alex MacDonald,alex.macdonald@treasurehub.club,Home Goods,Bath Products,.5,24,60,,0,0,1,Sun Oct 19 2025 15:16:27 GMT-0500 (Central Daylight Time),Sun Oct 19 2025 15:16:47 GMT-0500 (Central Daylight Time),,
