ID,Item ID,Title,Description,Price,Sale Price,Status,Condition,Brand,Model Number,Serial Number,Location,Seller Name,Seller Email,Department,Category,Height,Width,Depth,Weight,Photos Count,Videos Count,Views,Created At,Updated At,Available From,Available Until
cmgvrybgs000bjw04whzpzcla,1YQXO8,"Tiveney 3x5 Black Outdoor Easy Jute Checkered Entry Rug","Enhance your entryway with the Tiveney 3x5 Black Outdoor Easy Jute Checkered Entry Rug. This stylish and functional rug is designed to withstand outdoor conditions while adding a touch of farmhouse charm to your front porch or patio. Made from durable jute, it features a classic checkered pattern that complements a variety of decor styles. The non-slip backing ensures it stays in place, providing safety and comfort for your family and guests. Easy to clean and maintain, this rug is perfect for high-traffic areas, making it an ideal choice for both indoor and outdoor use.",29.99,,active,,Tiveney,,,,Alex MacDonald,alex.macdonald@treasurehub.club,Home Goods,Home Decor,0.5,60,36,,0,0,4,Fri Oct 17 2025 23:25:29 GMT-0500 (Central Daylight Time),Sun Oct 19 2025 04:56:30 GMT-0500 (Central Daylight Time),,
cmgvrmn340006jw04z6dzp9pb,OOGR40,"Deerly 3x5 Boho Moroccan Farmhouse Rug","The Deerly 3x5 Boho Moroccan Farmhouse Rug is a stylish and versatile addition to any living space. This machine washable rug features a soft, low pile that is perfect for high-traffic areas like the living room, kitchen, or bedroom. The neutral off white and grey color scheme complements a variety of decor styles, from bohemian to modern farmhouse. With its non-slip backing, this rug stays securely in place, providing both comfort and safety. Ideal for those who appreciate both aesthetics and practicality, this rug is a must-have for any home.",35,,active,,Deerly,,,,Alex MacDonald,alex.macdonald@treasurehub.club,Home Goods,Home Decor,0.5,60,36,,0,0,2,Fri Oct 17 2025 23:16:24 GMT-0500 (Central Daylight Time),Sat Oct 18 2025 16:16:18 GMT-0500 (Central Daylight Time),,
cmgvrl5xt0001jw04vv131cqk,ZYZRBK,"IKEA Black Coffee Table with Minor Damage","This is a classic black coffee table from IKEA. It features a sleek and functional design, perfect for any living room setting. The table measures 18.5 inches in height, 46.5 inches in width, and 29.5 inches in depth. Despite its age, it remains a sturdy piece, though it does have some signs of wear and damage in a few places, typical for a piece of its age. These imperfections do not affect its functionality and add a touch of character to the table.",40,,active,,IKEA,,,,Alex MacDonald,alex.macdonald@treasurehub.club,Furniture,Living Room,18.5,46.5,29.5,,0,0,4,Fri Oct 17 2025 23:15:16 GMT-0500 (Central Daylight Time),Mon Oct 20 2025 06:02:31 GMT-0500 (Central Daylight Time),,
cmgvqzrhj000bl404bwnt9rhq,S1AKNC,"Fixwal 5-Shelf Over The Door Hanging Pantry Organizer","The Fixwal 5-Shelf Over The Door Hanging Pantry Organizer is a versatile and practical storage solution designed to maximize space in your home. With its ultra-sturdy construction, this organizer can hold up to 25 pounds, making it ideal for storing a variety of items such as pantry goods, bathroom essentials, or nursery supplies. The clear plastic pockets allow for easy visibility and access to your items, ensuring everything is neatly organized and within reach. Perfect for closets, bedrooms, nurseries, bathrooms, and more, this organizer helps you declutter and optimize your living space efficiently.",14.99,,active,,Fixwal,,,,Alex MacDonald,alex.macdonald@treasurehub.club,Home Goods,Storage & Organization,60,14,7,,0,0,2,Fri Oct 17 2025 22:58:37 GMT-0500 (Central Daylight Time),Sat Oct 18 2025 16:14:37 GMT-0500 (Central Daylight Time),,
cmgvqrond001ajx04h5cct13r,UZ58FE,"Isyorefam Funny Game Bath Mat Black Gamepad Design","The Isyorefam Funny Game Bath Mat is a unique and playful addition to any bathroom or bedroom. Featuring a cool black gamepad design, this rug is both stylish and functional. Made from soft, absorbent materials, it provides comfort underfoot while effectively soaking up moisture. The non-slip backing ensures safety, making it ideal for use in wet areas. Measuring 20""x32"", this small bath rug is perfect for adding a touch of fun to your space.",18.99,,active,,Isyorefam,,,,Alex MacDonald,alex.macdonald@treasurehub.club,Home Goods,Bath Products,0.5,32,20,,0,0,2,Fri Oct 17 2025 22:52:20 GMT-0500 (Central Daylight Time),Sat Oct 18 2025 16:13:46 GMT-0500 (Central Daylight Time),,
cmgvqr9va0015jx0420t90bbn,4WOOCZ,"MIULEE Set of 2 Non Slip Shaggy Bathroom Rugs, Sage Green","Enhance your bathroom decor with the MIULEE Set of 2 Non Slip Shaggy Bathroom Rugs. These extra thick and soft bath mats are designed to provide a plush feel underfoot while being highly absorbent to keep your bathroom floors dry. The sage green color adds a touch of elegance and tranquility to your space. Made from high-quality microfiber, these rugs are machine washable, ensuring easy maintenance and long-lasting use. Perfect for placing in front of your tub or shower, these rugs offer both style and functionality.",19.99,,active,,MIULEE,,,,Alex MacDonald,alex.macdonald@treasurehub.club,Home Goods,Bath Products,0.7,24,16,,0,0,3,Fri Oct 17 2025 22:52:01 GMT-0500 (Central Daylight Time),Sat Oct 18 2025 16:14:25 GMT-0500 (Central Daylight Time),,
cmgvqh8is000gie04ujzcj93z,X1QCU7,"HIGOGOGO Round Stuffed Pouf Ottoman, Navy Corduroy","Introducing the HIGOGOGO Round Stuffed Pouf Ottoman, a versatile and stylish addition to any living room. This pouf features a plush corduroy exterior in a deep navy hue, filled with foam chunks for a comfortable and supportive seating experience. Measuring 20 inches in diameter and 15 inches in height, it serves as a perfect footrest or extra seat. The furry and fluffy texture adds a touch of luxury, while its compact size makes it ideal for small spaces. Whether used as a foot stool or a decorative piece, this pouf is sure to enhance your home decor.",39.99,,active,,HIGOGOGO,,,,Alex MacDonald,alex.macdonald@treasurehub.club,Home Goods,Furniture,15,20,20,,0,0,2,Fri Oct 17 2025 22:44:13 GMT-0500 (Central Daylight Time),Sat Oct 18 2025 16:11:33 GMT-0500 (Central Daylight Time),,
cmgvqg84c000bie04kvioreqj,HHCTX1,"Ohocut Sweet Cheeks Pink Bath Mat - Non Slip & Microfiber","The Ohocut Sweet Cheeks Bath Mat is a delightful addition to any bathroom, offering both style and functionality. This cute pink bath mat measures 24"" x 16"" and is crafted from high-quality microfiber, ensuring a soft and comfortable feel underfoot. Designed with anti-slip backing, it provides safety and stability, making it perfect for use in the bathroom. The blush pink color adds a touch of elegance and charm to your bathroom decor, while the funny design brings a smile to your face every time you step out of the shower. Ideal for those looking to enhance their bathroom's aesthetic with a touch of humor and warmth.",12.99,,active,,Ohocut,,,,Alex MacDonald,alex.macdonald@treasurehub.club,Home Goods,Bath Products,0.5,24,16,,0,0,2,Fri Oct 17 2025 22:43:25 GMT-0500 (Central Daylight Time),Sat Oct 18 2025 16:10:57 GMT-0500 (Central Daylight Time),,
cmgvqb2h50006ie04rp0n286r,SKKXPA,"XHKDSYMC 16 Inch Tall Portable Folding Camping Stool","The XHKDSYMC Folding Camping Stool is a versatile and lightweight seating solution designed for outdoor enthusiasts. Standing at 16 inches tall, this stool is crafted from durable aluminum alloy, ensuring both strength and portability. Its compact design allows for easy folding and storage, making it an ideal companion for camping, hiking, fishing, and BBQs. The stool comes in a vibrant red color and includes a convenient carry bag for effortless transportation. Whether you're setting up camp in the wilderness or enjoying a day at the beach, this stool provides reliable seating comfort.",10,,active,,XHKDSYMC,,,,Alex MacDonald,alex.macdonald@treasurehub.club,Sporting Goods,Outdoor Sports,16,12,8,,0,0,5,Fri Oct 17 2025 22:39:25 GMT-0500 (Central Daylight Time),Mon Oct 20 2025 21:46:16 GMT-0500 (Central Daylight Time),,
cmgvqa9tk0001ie04h895tss6,EG2FAA,"DELISEPT 2x6 Ft Washable Kitchen Runner Rug in Pink and Green","Enhance your home décor with the DELISEPT 2x6 Ft Washable Kitchen Runner Rug. This vintage-style runner features a charming pink and green design, perfect for adding a touch of elegance to any entryway, hallway, bedroom, bathroom, or laundry room. Made from faux wool, this low-pile carpet runner is not only stylish but also practical, offering a non-slip backing to ensure safety in high-traffic areas. Its washable nature makes it easy to maintain, ensuring it remains a vibrant addition to your home for years to come.",24.99,,active,,DELISEPT,,,,Alex MacDonald,alex.macdonald@treasurehub.club,Home Goods,Home Decor,0.5,24,72,,0,0,3,Fri Oct 17 2025 22:38:48 GMT-0500 (Central Daylight Time),Sat Oct 18 2025 16:10:32 GMT-0500 (Central Daylight Time),,
cmgvpw5940010jx04cyrrg6px,ZI7O6N,"HY HAO YUN LAI Washable 2x3 Entryway Area Rug","This HY HAO YUN LAI washable area rug is perfect for entryways, kitchens, bathrooms, and bedrooms. With a vintage design and non-slip backing, it offers both style and functionality. The rug is water-resistant and features a soft, low pile, making it an ideal addition to any room. Its cream and beige color scheme complements a variety of decor styles, while its 2x3 size fits perfectly in smaller spaces.",14.99,,active,,HY HAO YUN LAI,,,,Alex MacDonald,alex.macdonald@treasurehub.club,Home Goods,Home Decor,0.5,24,36,,0,0,3,Fri Oct 17 2025 22:27:49 GMT-0500 (Central Daylight Time),Sat Oct 18 2025 16:10:05 GMT-0500 (Central Daylight Time),,
cmgvpp23i000vjx04vrpptkfg,98MHS1,"UNIBATH Green Leaf Bathroom Rug 18x24 - Plush Microfiber","Enhance your bathroom decor with the UNIBATH Green Leaf Bathroom Rug. Measuring 18x24 inches, this plush and fluffy bath mat is designed to provide ultimate comfort and absorbency. The non-slip backing ensures safety, making it perfect for use in front of sinks, bathtubs, or showers. Made from soft microfiber, this rug is not only absorbent but also machine washable, ensuring easy maintenance. Its vibrant green color and leaf pattern add a touch of nature to your bathroom, making it a stylish and functional addition to any home.",18.89,,active,,UNIBATH,,,,Alex MacDonald,alex.macdonald@treasurehub.club,Home Goods,Bath Products,0.5,18,24,,0,0,3,Fri Oct 17 2025 22:22:18 GMT-0500 (Central Daylight Time),Sun Oct 19 2025 08:06:45 GMT-0500 (Central Daylight Time),,
cmgvpgrsv000qjx04ajrrvimi,17FTDI,"Starryle 2-Piece Chenille Bath Rug Set, Dark Gray","Enhance your bathroom decor with the Starryle Bathroom Rugs Set, featuring two pieces of extra soft and absorbent fluffy striped chenille bath mats. These non-slip bathroom floor mats are machine washable, ensuring easy maintenance and long-lasting use. The set includes a large rug measuring 21"" x 47"" and a smaller rug measuring 17"" x 25"", both in a sophisticated dark gray color that complements any bathroom style.",34.99,,active,,Starryle,,,,Alex MacDonald,alex.macdonald@treasurehub.club,Home Goods,Bath Products,0.5,21,47,,0,0,3,Fri Oct 17 2025 22:15:51 GMT-0500 (Central Daylight Time),Sat Oct 18 2025 16:29:05 GMT-0500 (Central Daylight Time),,
cmgvpfoaf000ljx04ckslwjhj,LCCH7U,"Seek4comfortable Crocodile-Shaped Green Cartoon Bath Mat","Add a touch of fun and functionality to your bathroom with the Seek4comfortable Crocodile-Shaped Green Cartoon Animal Bath Mat. This non-slip, absorbent, and plush bath mat is designed to provide both safety and comfort. Measuring 39.4 x 17.7 inches, it offers ample coverage and is perfect for any bathroom setting. The vibrant green color and playful crocodile design make it an ideal choice for kids' bathrooms or anyone looking to add a whimsical touch to their home decor. Made from high-quality materials, this bath mat ensures durability and long-lasting use.",24.99,,active,,Seek4comfortable,,,,Alex MacDonald,alex.macdonald@treasurehub.club,Home Goods,Bath Products,0.5,17.7,39.4,,0,0,3,Fri Oct 17 2025 22:15:00 GMT-0500 (Central Daylight Time),Sat Oct 18 2025 14:16:33 GMT-0500 (Central Daylight Time),,
cmgvp5uep000gjx04dvcknu99,H0SZCH,"Oriental Area Rugs 2′ × 4′ in blue tones","Add a touch of character and vintage charm to your space with this Oriental Retro Area Rug.
Perfect for entryways, kitchens, bathrooms, or beside the bed, this rug blends timeless design with modern practicality.

🌀 Details:

Size: 2ft x 4ft

Pattern: Vintage Oriental / Boho Medallion
Color Palette: Soft blues, creams, and subtle coral accents
Washable and easy to maintain — toss it in the machine with cold water and hang dry
Anti-slip TPE backing keeps it securely in place on smooth floors
Low pile and soft texture — ideal for high-traffic areas or layered looks",24.99,,active,,,,,,Alex MacDonald,alex.macdonald@treasurehub.club,Home Goods,Home Decor,0.5,24,48,,0,0,6,Fri Oct 17 2025 22:07:22 GMT-0500 (Central Daylight Time),Tue Oct 21 2025 00:06:47 GMT-0500 (Central Daylight Time),,
cmgvp1f9p0006l4048u47dz7n,5447Z3,"FROZZUR 2x6 Boho Green Runner Rug for Home Decor","Enhance your living space with the FROZZUR 2x6 Boho Green Runner Rug, perfect for adding a touch of vintage farmhouse charm to your hallway, kitchen, or bedroom. This non-slip, washable rug is designed for both style and practicality, making it an ideal choice for any home decor. The vibrant green color and boho pattern create a unique aesthetic that complements a variety of interior styles. Crafted with high-quality materials, this rug is durable and easy to maintain, ensuring long-lasting beauty and functionality.",24.99,,active,,FROZZUR,,,,Alex MacDonald,alex.macdonald@treasurehub.club,Home Goods,Home Decor,0.5,24,72,,0,0,2,Fri Oct 17 2025 22:03:55 GMT-0500 (Central Daylight Time),Sat Oct 18 2025 14:06:00 GMT-0500 (Central Daylight Time),,
cmgvori0b0001l40442wcu49c,LNY0PF,"Turkuaz Label 8 Ball Rug - 24 Inch White & Black","The Turkuaz Label 8 Ball Rug is a stylish and aesthetic addition to any bedroom or living room. Measuring 24 inches in diameter, this rug features a bold white and black design that is perfect for those looking to add a touch of Y2K room decor to their space. Crafted with high-quality materials, this rug is both durable and visually appealing, making it a great choice for any hypebeast or design enthusiast.",20.98,,active,,Turkuaz Label,,,,Alex MacDonald,alex.macdonald@treasurehub.club,Home Goods,Home Decor,0.5,24,24,,0,0,4,Fri Oct 17 2025 21:56:12 GMT-0500 (Central Daylight Time),Wed Oct 22 2025 13:10:24 GMT-0500 (Central Daylight Time),,
cmgvokxob0001jp04vqevfdbq,KZ2Y9F,"SOANNY Burgundy 6x9 ft Solid Soft Fluffy Area Rug","Enhance your living space with the SOANNY Area Rug, a perfect blend of style and comfort. This 6x9 ft large solid soft fluffy carpet is designed to add a touch of elegance to your bedroom or living room. The burgundy color brings warmth and sophistication, making it a versatile addition to any home decor. Crafted from plush, fuzzy shag material, this rug offers a luxurious feel underfoot. It is washable and features a non-slip backing, ensuring safety and convenience. Ideal for bedside or any area where you want to add a cozy touch, this rug is both functional and stylish. ($67.99 Retail Price)",45,,active,,SOANNY,,,,Alex MacDonald,alex.macdonald@treasurehub.club,Home Goods,Home Decor,0.5,72,96,,0,0,3,Fri Oct 17 2025 21:51:06 GMT-0500 (Central Daylight Time),Sat Oct 18 2025 14:05:18 GMT-0500 (Central Daylight Time),,
cmgvohklu000bjx048mrjhbzo,2R3KUC,"ONASAR 4x6 Grey and White Fluffy Shag Area Rug","Elevate your living space with the ONASAR 4x6 Grey and White Fluffy Shag Area Rug. This luxurious rug features a soft and comfy checkered design, perfect for adding a touch of elegance to any room. Its anti-skid backing ensures safety, making it ideal for bedrooms, living rooms, offices, and even kids' dorms or classrooms. Crafted with high-quality materials, this furry, fuzzy plush indoor carpet offers both style and comfort. Transform your space into a cozy haven with this versatile and durable area rug.",18.89,,active,,ONASAR,,,,Alex MacDonald,alex.macdonald@treasurehub.club,Home Goods,Home Decor,0.5,48,72,,0,0,4,Fri Oct 17 2025 21:48:29 GMT-0500 (Central Daylight Time),Wed Nov 05 2025 10:51:25 GMT-0600 (Central Standard Time),,
cmgvo5h9v0006jx04p9blkbad,EO9AXS,"RUGSURE Washable Vintage Charm Area Rug - Green, 2'6'' x 8'","Enhance your living space with the RUGSURE Washable Area Rug, designed to bring vintage charm and practicality to any room. This rug measures 2'6'' x 8', making it an ideal choice for hallways, bedrooms, or living areas. Crafted with a focus on durability, it is stain and water-resistant, ensuring it remains a staple in your home for years to come. The non-slip backing keeps it securely in place, making it perfect for high-traffic areas and homes with children or pets. Its green hue adds a touch of elegance and warmth, complementing various interior styles. ($50.99 Retail Price)",35,,active,,RUGSURE,,,,Alex MacDonald,alex.macdonald@treasurehub.club,Home Goods,Furniture,0.5,30,84,,0,0,3,Fri Oct 17 2025 21:39:05 GMT-0500 (Central Daylight Time),Sat Oct 18 2025 14:02:46 GMT-0500 (Central Daylight Time),,
cmgvnwo0b0001la0484vcsi3h,QUOYRY,"Jinchan Oriental 3x5 Area Rug - Light Grey Vintage Floral","Enhance your living space with the Jinchan Oriental 3x5 Area Rug. This machine washable, non-slip doormat is designed for entryways, bedrooms, kitchens, and living rooms. Its ultra-thin, low-pile construction makes it an ideal choice for high-traffic areas, while the vintage floral distressed pattern adds a touch of elegance to any decor. The rug's light grey color complements a variety of color schemes, making it a versatile addition to your home.",12,,active,,Jinchan,LPNPMDY7546180,,,Alex MacDonald,alex.macdonald@treasurehub.club,Home Goods,Home Decor,0.5,36,60,,0,0,2,Fri Oct 17 2025 21:32:14 GMT-0500 (Central Daylight Time),Sat Oct 18 2025 14:01:45 GMT-0500 (Central Daylight Time),,
cmgvnpvc60001jx04ts73g8fh,3ZQNAU,"LOCHAS Luxury Shag Area Rug 5x7 Feet Geometric Plush Fluffy","Transform your living space with the LOCHAS Luxury Shag Area Rug. Measuring 5x7 feet, this geometric plush rug is designed to add a touch of elegance and comfort to any room. The high pile shaggy texture is not only visually appealing but also provides a soft and cozy feel underfoot, making it perfect for bedrooms, living rooms, dorms, and kids' rooms. The grey and white Moroccan pattern complements a variety of interior styles, from modern to traditional. Crafted with high-quality materials, this rug is durable and easy to maintain, ensuring it remains a staple in your home decor for years to come. ($59.99 Retail Price)",45,,active,,LOCHAS,,,,Alex MacDonald,alex.macdonald@treasurehub.club,Home Goods,Home Decor,0.5,50,84,,0,0,3,Fri Oct 17 2025 21:26:57 GMT-0500 (Central Daylight Time),Sat Oct 18 2025 16:28:30 GMT-0500 (Central Daylight Time),,
cmgvniroh0001k404ix91j937,KH5GS1,"Soalmost Vintage Beige Runner Rug 2'x6' Washable Non-Slip","Enhance your home decor with the Soalmost Runner Rug, a perfect blend of style and functionality. This 2'x6' washable rug is designed for high-traffic areas like kitchens, bathrooms, and laundry rooms. Its non-slip backing ensures safety, while the vintage beige pattern adds a touch of elegance to any space. Made from durable materials, this rug is easy to maintain and built to last. Ideal for hallways and entryways, it offers both aesthetic appeal and practical benefits. ($38.99 Retail Price)",29.99,,active,,Soalmost,,,,Alex MacDonald,alex.macdonald@treasurehub.club,Home Goods,Home Decor,0.5,24,72,,0,0,3,Fri Oct 17 2025 21:21:25 GMT-0500 (Central Daylight Time),Sat Oct 18 2025 13:59:43 GMT-0500 (Central Daylight Time),,
cmgvn5aoa0001jr04gzvv2f6p,JD3PJY,"FROZZUR Boho Pink Runner Rug - 2x6 Vintage Farmhouse Style","Enhance your home decor with the FROZZUR 2x6 Boho Pink Runner Rug, perfect for adding a touch of vintage farmhouse charm to your hallway, kitchen, or bedroom. This non-slip, washable rug features a beautiful boho design in pink, making it a stylish and practical addition to any space. Ideal for those who appreciate both aesthetics and functionality, this rug is crafted to withstand everyday use while maintaining its vibrant appearance. ($49.99 Retail)",39.99,,active,,FROZZUR,,,,Alex MacDonald,alex.macdonald@treasurehub.club,Home Goods,Home Decor,0.5,24,72,,0,0,3,Fri Oct 17 2025 21:10:57 GMT-0500 (Central Daylight Time),Sat Oct 18 2025 13:57:34 GMT-0500 (Central Daylight Time),,
cmgpgo7u10001js0435g134ia,2NW494,"RUGSURE Washable Vintage Tribal Area Rug, 5' x 7', Grey and Blue","Enhance your living space with the RUGSURE Washable Area Rug, designed to bring both style and functionality to any room. This vintage tribal area rug, measuring 5' x 7', features a sophisticated grey and blue pattern that complements a variety of home decors. Made with stain and water-resistant materials, this rug is perfect for homes with pets and children, ensuring longevity and easy maintenance. The non-slip backing provides added safety, making it an ideal choice for living rooms, bedrooms, kids' rooms, and nurseries.",54.99,,active,,RUGSURE,,,,Alex MacDonald,alex.macdonald@treasurehub.club,Home Goods,Home Decor,0.5,60,83.5,,0,0,3,Mon Oct 13 2025 13:23:05 GMT-0500 (Central Daylight Time),Fri Oct 17 2025 14:50:37 GMT-0500 (Central Daylight Time),,
cmgpg0lvd0001l204zry2c32t,W18BU7,"Aelenmu Round Rug 5ft Circle Rug - Beige Ivory","This brand new Aelenmu Round Rug is a perfect addition to any room, offering a blend of style and functionality. With a diameter of 5 feet, this circular area rug features a low pile design that is both washable and non-slip, making it ideal for high-traffic areas such as bedrooms, bathrooms, entryways, kids' rooms, offices, and college dorms. The abstract pattern in beige and ivory tones adds a touch of elegance and warmth to your space. Crafted with quality materials, this rug is designed to withstand everyday use while maintaining its aesthetic appeal.",149.99,,active,,Aelenmu,,,,Alex MacDonald,alex.macdonald@treasurehub.club,Home Goods,Home Decor,0.2,60,60,,0,0,4,Mon Oct 13 2025 13:04:44 GMT-0500 (Central Daylight Time),Fri Oct 17 2025 20:48:16 GMT-0500 (Central Daylight Time),,
cmgpfu9p20001l804xwbwgkfq,PIYLXL,"BSICPRO 2-Piece Bathroom Mat Set, Light Taupe, Chenille","Upgrade your bathroom with the BSICPRO 2-Piece Bathroom Mat Set, designed for both style and functionality. This set includes two mats, measuring 20"" x 47"" and 16"" x 24"", perfect for adding comfort and warmth to your bathroom floor. Made from thick, absorbent chenille, these mats are not only soft and shaggy but also highly absorbent, ensuring your floors stay dry. The non-slip backing provides safety, preventing slips and falls. Easy to maintain, these mats are machine washable, making them a practical addition to any bathroom decor.",29.99,,active,,BSICPRO,,,,Alex MacDonald,alex.macdonald@treasurehub.club,Home Goods,Bath Products,0.5,20,57,,0,0,3,Mon Oct 13 2025 12:59:48 GMT-0500 (Central Daylight Time),Thu Oct 16 2025 02:06:05 GMT-0500 (Central Daylight Time),,
cmgpfnxvg000ljy04otacce8a,K02ND6,"Suncast Deck Box 170 Gallon Storage Solution","Introducing the Suncast Deck Box, a robust and spacious storage solution perfect for your outdoor needs. With a generous capacity of 170 gallons, this deck box is ideal for storing patio cushions, garden tools, pool accessories, and more. Made by Suncast Corporation, a leader in outdoor storage solutions, this deck box combines functionality with style, ensuring your outdoor space remains tidy and organized. Its durable construction is designed to withstand the elements, providing long-lasting performance and protection for your belongings.",119.99,,active,,Suncast,,,,Alex MacDonald,alex.macdonald@treasurehub.club,Garden & Outdoor,Outdoor Furniture,29,57.6,30,,0,0,8,Mon Oct 13 2025 12:54:53 GMT-0500 (Central Daylight Time),Sat Oct 18 2025 08:06:29 GMT-0500 (Central Daylight Time),,
cmgpfihaw000ejy04r7l06ys2,PLCZPD,"Lifetime 165 Gallon Deck Box by Lifetime Products Inc","The Lifetime 165 Gallon Deck Box is a robust and spacious storage solution designed for outdoor use. Manufactured by Lifetime Products Inc, this deck box offers a generous 165-gallon capacity, perfect for storing patio furniture cushions, garden tools, and other outdoor accessories. Constructed from high-density polyethylene (HDPE), it ensures durability and resistance to weather conditions. The box features a lockable lid for added security and molded handles for easy portability. Its sleek design and neutral color make it a versatile addition to any garden or patio setting.",119.99,,sold,,Lifetime Products Inc,1713602,,,Alex MacDonald,alex.macdonald@treasurehub.club,Garden & Outdoor,Outdoor Furniture,30.2,58.2,28.5,,0,0,2,Mon Oct 13 2025 12:50:38 GMT-0500 (Central Daylight Time),Sun Oct 19 2025 11:59:14 GMT-0500 (Central Daylight Time),,
