ID,Item ID,Title,Description,Price,Sale Price,Status,Condition,Brand,Model Number,Serial Number,Location,Seller Name,Seller Email,Department,Category,Height,Width,Depth,Weight,Photos Count,Videos Count,Views,Created At,Updated At,Available From,Available Until
cmgpfifu00006jy04z9lc6do0,DEK5A3,"Lifetime 165 Gallon Deck Box by Lifetime Products Inc","The Lifetime 165 Gallon Deck Box is a robust and spacious storage solution designed for outdoor use. Manufactured by Lifetime Products Inc, this deck box offers a generous 165-gallon capacity, perfect for storing patio furniture cushions, garden tools, and other outdoor accessories. Constructed from high-density polyethylene (HDPE), it ensures durability and resistance to weather conditions. The box features a lockable lid for added security and molded handles for easy portability. Its sleek design and neutral color make it a versatile addition to any garden or patio setting.",119.99,,sold,,Lifetime Products Inc,1713602,,,Alex MacDonald,alex.macdonald@treasurehub.club,Garden & Outdoor,Outdoor Furniture,30.2,58.2,28.5,,0,0,3,Mon Oct 13 2025 12:50:36 GMT-0500 (Central Daylight Time),Sun Oct 19 2025 14:18:03 GMT-0500 (Central Daylight Time),,
cmgpesi6w0001jy045rvodayh,BS4ELZ,"PureCozy Dark Black Runner Rug 2x6 - Machine Washable","Enhance your home decor with the PureCozy Dark Black Runner Rug, designed to add a touch of vintage elegance to any space. This 2x6 runner rug is perfect for hallways, kitchens, or any area that needs a stylish accent. Made from high-quality materials, it features a retro floral pattern that complements both modern and traditional interiors. The rug is machine washable, ensuring easy maintenance and long-lasting beauty. Its non-slip backing provides safety and stability, making it ideal for high-traffic areas. Whether placed in the bedroom, office, or dining room, this rug is a versatile addition to your home.",29.99,,active,,PureCozy,,,,Alex MacDonald,alex.macdonald@treasurehub.club,Home Goods,Home Decor,0.5,24,72,,0,0,4,Mon Oct 13 2025 12:30:26 GMT-0500 (Central Daylight Time),Tue Oct 21 2025 07:56:09 GMT-0500 (Central Daylight Time),,
cmg1dptfz0003jp0426pil8ly,DN3M06,"Lifetime Vertical Shed","The Lifetime Vertical Shed is a robust and reliable storage solution designed by Lifetime Products Inc. Ideal for organizing your garden tools, outdoor equipment, and other essentials, this shed offers a durable and weather-resistant construction. With its vertical design, it maximizes storage space while occupying minimal ground area, making it perfect for smaller yards or gardens. The shed features a high-density polyethylene (HDPE) construction with steel-reinforced walls, ensuring long-lasting durability and protection against the elements. Its UV-protected panels prevent fading and cracking, maintaining the shed's appearance over time. The shed's double doors provide easy access and are lockable for added security. Whether you're looking to declutter your garden or store seasonal items, the Lifetime Vertical Shed is an excellent choice for homeowners seeking quality and functionality.",249.99,,sold,,Lifetime Products Inc,1500001,,,Alex MacDonald,alex.macdonald@treasurehub.club,Garden & Outdoor,Outdoor Furniture,68.6,56.4,31,,0,0,17,Fri Sep 26 2025 16:53:53 GMT-0500 (Central Daylight Time),Fri Oct 10 2025 07:10:25 GMT-0500 (Central Daylight Time),,
cmg1dkj0o0008jr04gfpu4v2f,0HT9OX,"Eucalyptus Swing Lounge by Thirtieth Sense Co Ltd","Experience ultimate relaxation with the Eucalyptus Swing Lounge from Thirtieth Sense Co Ltd. Crafted for comfort and style, this swing lounge is perfect for any garden or outdoor setting. Made from durable eucalyptus wood, it offers a sturdy and elegant design that complements any outdoor decor. Whether you're looking to unwind with a book or enjoy the fresh air, this swing lounge provides a serene spot to do so. Its robust construction ensures longevity, making it a valuable addition to your outdoor furniture collection.",55.99,,active,,Thirtieth Sense Co Ltd,1713374,,,Alex MacDonald,alex.macdonald@treasurehub.club,Furniture,Outdoor,37,25,43,,0,0,6,Fri Sep 26 2025 16:49:46 GMT-0500 (Central Daylight Time),Wed Oct 15 2025 00:06:18 GMT-0500 (Central Daylight Time),,
cmg1dhcp90005js0444lnc8qd,51TWOF,"Eucalyptus Swing Lounge by Thirtieth Sense Co Ltd","Experience ultimate relaxation with the Eucalyptus Swing Lounge by Thirtieth Sense Co Ltd. This elegant outdoor furniture piece is designed to provide comfort and style to your garden or patio. Crafted from high-quality eucalyptus wood, it offers durability and a natural aesthetic that complements any outdoor setting. The swing lounge features a spacious seat, perfect for unwinding with a book or enjoying a sunny afternoon. Its sturdy construction ensures stability, while the smooth finish adds a touch of sophistication to your outdoor decor.",55.99,,active,,Thirtieth Sense Co Ltd,1713374,,,Alex MacDonald,alex.macdonald@treasurehub.club,Furniture,Outdoor,37,25,43,,0,0,4,Fri Sep 26 2025 16:47:18 GMT-0500 (Central Daylight Time),Sun Oct 19 2025 12:50:10 GMT-0500 (Central Daylight Time),,
cmg1dda2p0001jr04oxyrkzz9,3984A7,"Mullally Intl Inc Patio Privacy Screen","Enhance your outdoor space with this elegant patio privacy screen from Mullally Intl Inc. Designed to provide both style and functionality, this screen offers a perfect solution for creating a secluded area in your garden or patio. Crafted with durable materials, it ensures longevity and withstands various weather conditions. Whether you're looking to add a decorative touch or need privacy from neighbors, this screen is an ideal addition to any outdoor setting.",125,,active,,Mullally Intl Inc,,,,Alex MacDonald,alex.macdonald@treasurehub.club,Furniture,Outdoor,71.2,19.4,44.8,,0,0,5,Fri Sep 26 2025 16:44:08 GMT-0500 (Central Daylight Time),Sat Oct 11 2025 15:45:49 GMT-0500 (Central Daylight Time),,
cmg1avgoe000fky04p4somlc7,C4530X,"Midea MRM33S9ASL 3.3 Cu Ft Refrigerator","The Midea MRM33S9ASL is a compact 3.3 cubic feet refrigerator, perfect for small spaces such as dorm rooms, offices, or as a secondary fridge. Manufactured by Midea America Corp, this unit combines efficiency with a sleek design. Its compact size doesn't compromise on storage, offering ample space for your essentials. Ideal for those seeking a reliable and space-saving cooling solution.",79.99,,sold,,Midea,MRM33S9ASL,,,Alex MacDonald,alex.macdonald@treasurehub.club,Home Goods,Appliances,1,1,1,,0,0,3,Fri Sep 26 2025 15:34:17 GMT-0500 (Central Daylight Time),Sat Oct 18 2025 01:44:21 GMT-0500 (Central Daylight Time),,
cmg1ahpqq000aky040qotvgqg,H3F9I9,"Elevated Cedar Planter by Dobi and Associates Inc","This elevated cedar planter by Dobi and Associates Inc is the perfect addition to your garden, offering both functionality and style. Crafted from high-quality cedar, this planter is designed to withstand the elements while providing an ideal environment for your plants. Its elevated design makes gardening accessible and reduces strain on your back, making it a great choice for gardeners of all ages. With a generous planting area, you can cultivate a variety of plants, from flowers to vegetables, enhancing the beauty and productivity of your outdoor space.",149.99,,active,,Dobi and Associates Inc,1649864,,,Alex MacDonald,alex.macdonald@treasurehub.club,Garden & Outdoor,Garden Tools,30,49,34,,0,0,6,Fri Sep 26 2025 15:23:36 GMT-0500 (Central Daylight Time),Sun Oct 12 2025 14:25:20 GMT-0500 (Central Daylight Time),,
cmg1acc4u0003ky047yy0q0cw,PGVNK9,"Fiskars 16ft Pole Pruner","The Fiskars 16ft Pole Pruner is an essential tool for any gardener looking to maintain their trees and shrubs with ease. Manufactured by Fiskars Inc, a leader in garden tools, this pruner offers a reach of up to 16 feet, allowing you to trim high branches without the need for a ladder. Its lightweight design ensures easy handling, while the durable construction guarantees long-lasting performance. Ideal for both amateur gardeners and professional landscapers, this pole pruner is a must-have for maintaining a beautiful and healthy garden.",49.99,,active,,Fiskars,1713545,,,Alex MacDonald,alex.macdonald@treasurehub.club,Garden & Outdoor,Garden Tools,192,10,1,,0,0,3,Fri Sep 26 2025 15:19:25 GMT-0500 (Central Daylight Time),Sun Oct 12 2025 04:39:27 GMT-0500 (Central Daylight Time),,
cmg1a5ycw0003jl046vkqw7s2,DG0XL4,"Dobi Self-Watering Plant System","Introducing the Dobi Self-Watering Plant System, a perfect solution for garden enthusiasts who want to maintain lush and healthy plants with minimal effort. This innovative system measures 23x49x30 inches, making it ideal for a variety of plant sizes and types. Crafted by Dobi and Associates Inc, this product ensures your plants receive the right amount of water, reducing the need for constant monitoring. Its sleek design fits seamlessly into any garden or outdoor space, providing both functionality and aesthetic appeal.",90,,active,,Dobi and Associates Inc,1133342,,,Alex MacDonald,alex.macdonald@treasurehub.club,Garden & Outdoor,Garden Tools,23,49,30,,0,0,6,Fri Sep 26 2025 15:14:27 GMT-0500 (Central Daylight Time),Mon Oct 06 2025 03:16:33 GMT-0500 (Central Daylight Time),,
cmg1a22c9000fld04o3kgjwhx,VQTFSR,"Hisense 35-Pint Dehumidifier","The Hisense 35-Pint Dehumidifier is a reliable and efficient solution for managing humidity levels in your home. Manufactured by Hisense USA Corporation, this small appliance is designed to remove up to 35 pints of moisture from the air per day, making it ideal for medium-sized rooms. Its compact design allows for easy placement in any room, while the built-in wheels and handles provide convenient mobility. The dehumidifier features an adjustable humidistat, automatic shut-off, and a washable filter, ensuring optimal performance and easy maintenance. With its quiet operation and energy-efficient design, the Hisense 35-Pint Dehumidifier is perfect for maintaining a comfortable and healthy living environment.",119.99,,active,,Hisense,,,,Alex MacDonald,alex.macdonald@treasurehub.club,Home Goods,Kitchen & Dining Products,21,17.5,11.3,,0,0,7,Fri Sep 26 2025 15:11:26 GMT-0500 (Central Daylight Time),Sun Oct 19 2025 21:11:21 GMT-0500 (Central Daylight Time),,
cmg19v3sy0008ld04tvqtqshe,C9SGQA,"Keter Cortina 200G Deck Box by Keter US Inc","The Keter Cortina 200G Deck Box is an ideal storage solution for your outdoor space, offering both functionality and style. Manufactured by Keter US Inc, this deck box is designed to withstand the elements while providing ample storage for your gardening tools, cushions, and other outdoor essentials. Its robust construction ensures durability, making it a reliable addition to your garden or patio.",129.99,,sold,,Keter,1703891,,,Alex MacDonald,alex.macdonald@treasurehub.club,Garden & Outdoor,Outdoor Furniture,35.4,59.7,28.5,,0,0,5,Fri Sep 26 2025 15:06:01 GMT-0500 (Central Daylight Time),Wed Oct 22 2025 23:05:11 GMT-0500 (Central Daylight Time),,
cmg19kcan0003ky04htuhpzjn,2BKJNI,"Fiskars 16ft Pole Pruner","The Fiskars 16ft Pole Pruner is an essential tool for any gardening enthusiast. Designed by Fiskars Inc, a leader in gardening equipment, this pole pruner allows you to reach high branches with ease, ensuring your garden remains well-maintained and beautiful. With a robust build and user-friendly design, it is perfect for trimming and pruning trees and shrubs. The pruner is made from durable materials to withstand regular use, making it a reliable addition to your gardening toolkit.",49.99,,active,,Fiskars,1713545,,,Alex MacDonald,alex.macdonald@treasurehub.club,Garden & Outdoor,Garden Tools,192,10,2,,0,0,6,Fri Sep 26 2025 14:57:39 GMT-0500 (Central Daylight Time),Mon Oct 20 2025 19:33:21 GMT-0500 (Central Daylight Time),,
cmg19cuu30001l104e6vzwm9u,X3B9BC,"RJ Brands Iceman Water Cooler and Ice Maker","This RJ Brands Iceman Water Cooler and Ice Maker is in excellent condition, providing both convenience and efficiency for your home or office. With its sleek design and reliable performance, it offers a seamless way to enjoy chilled water and ice at your fingertips. The appliance is perfect for those who appreciate both functionality and style in their kitchen or breakroom. It is part of the small appliances category, making it a versatile addition to any space. The unit is designed to deliver consistent ice production and water cooling, ensuring you have access to refreshing beverages whenever you need them.",199.99,,active,,RJ Brands,,,,Alex MacDonald,alex.macdonald@treasurehub.club,Home Goods,Kitchen & Dining Products,45,12.5,15.5,,0,0,4,Fri Sep 26 2025 14:51:50 GMT-0500 (Central Daylight Time),Tue Oct 14 2025 00:30:44 GMT-0500 (Central Daylight Time),,
cmg190dsj0003ld043qx5ei98,JF4OBJ,"Primo Water Cooler 601234","This Primo Water Cooler, model 601234, is in excellent condition. Manufactured by Primo Water Operations, it is a reliable appliance perfect for any home or office setting. Known for its efficiency and durability, this water cooler provides easy access to hot and cold water, making it a convenient addition to your daily routine. Its sleek design fits seamlessly into any space, offering both functionality and style.",125,,active,,Primo,601234,,,Alex MacDonald,alex.macdonald@treasurehub.club,Home Goods,Kitchen & Dining Products,41.5,12.5,14,,0,0,2,Fri Sep 26 2025 14:42:08 GMT-0500 (Central Daylight Time),Sun Sep 28 2025 17:53:57 GMT-0500 (Central Daylight Time),,
cmg18rmcd0001l804mvcf80ei,FB0VT4,"Danby 3.1 CuFt Beverage Center Refrigerator","This Danby 3.1 CuFt Beverage Center is the perfect addition to any home, offering a sleek and efficient way to store your favorite beverages. With a compact design, it fits seamlessly into any space, making it ideal for kitchens, home bars, or entertainment areas. The unit features a clear glass door, adjustable shelves, and a temperature control system to keep your drinks at the perfect temperature. Its excellent condition ensures reliable performance and a modern aesthetic.",199.99,,sold,,Danby,,,,Alex MacDonald,alex.macdonald@treasurehub.club,Home Goods,Appliances,34,17.5,19.8,,0,0,6,Fri Sep 26 2025 14:35:19 GMT-0500 (Central Daylight Time),Fri Oct 17 2025 22:45:28 GMT-0500 (Central Daylight Time),,
cmftx1tri000dl804ewi9i8l2,2K6B66,"Brio 740 Bottom Load Water Dispenser","This Brio 740 Bottom Load Water Dispenser is in mint condition, offering a sleek and convenient solution for your hydration needs. Designed by Brio Water Technology Inc, this appliance is perfect for both home and office settings. It features a bottom loading design, making it easy to replace water bottles without heavy lifting. The dispenser provides both hot and cold water options, ensuring you have access to your preferred water temperature at any time. Its modern design and durable construction make it a stylish and practical addition to any space.",199.99,,active,,Brio,740,,,Alex MacDonald,alex.macdonald@treasurehub.club,Home Goods,Kitchen & Dining Products,43,12,13.5,,0,0,10,Sun Sep 21 2025 11:32:56 GMT-0500 (Central Daylight Time),Wed Oct 15 2025 02:05:23 GMT-0500 (Central Daylight Time),,
cmftwvksb001si804vxixxnat,BRJ7ZC,"RJ Brands Iceman Water Cooler and Ice Maker","This RJ Brands Iceman Water Cooler and Ice Maker is in excellent condition, offering a convenient and efficient solution for your cooling needs. Designed to provide both water cooling and ice-making capabilities, this appliance is perfect for home or office use. With its sleek design and reliable performance, it ensures you have access to chilled water and ice at any time. The unit is fully functional and shows no visible signs of wear, making it a great addition to any kitchen or breakroom.",199.99,,active,,RJ Brands,1963170,,,Alex MacDonald,alex.macdonald@treasurehub.club,Home Goods,Kitchen & Dining Products,45,12.5,15.5,,0,0,7,Sun Sep 21 2025 11:28:05 GMT-0500 (Central Daylight Time),Sun Oct 12 2025 12:12:39 GMT-0500 (Central Daylight Time),,
cmftwqmhv001li804f0t9oeb2,SW6UUJ,"BRIO 740 Bottom Load Water Dispenser","The BRIO 740 Bottom Load Water Dispenser is a high-quality appliance designed for convenience and efficiency. Manufactured by BRIO Water Technology Inc, this dispenser is perfect for home or office use. Its bottom load feature makes it easy to replace water bottles without the hassle of lifting heavy containers. The sleek design complements any space, and its mint condition ensures it functions as if brand new. Ideal for those seeking a reliable and stylish water dispensing solution.",199.99,,sold,,BRIO,740,,,Alex MacDonald,alex.macdonald@treasurehub.club,Home Goods,Kitchen & Dining Products,43,12,13.5,,0,0,7,Sun Sep 21 2025 11:24:14 GMT-0500 (Central Daylight Time),Tue Oct 21 2025 01:52:04 GMT-0500 (Central Daylight Time),,
cmftwlpov001ei804hr17q8o4,N3RA8A,"Karcher S4 Push Sweeper - Efficient Cleaning Solution","The Karcher S4 Push Sweeper is a powerful and efficient cleaning tool designed to make outdoor cleaning tasks easier and more effective. Manufactured by Karcher North America Inc, this sweeper is perfect for cleaning driveways, sidewalks, and patios. With its robust design and high-quality construction, the S4 Push Sweeper offers exceptional performance and durability. It features a large sweeping width and a spacious waste container, allowing you to cover more ground with fewer interruptions. The ergonomic handle ensures comfortable use, while the compact design makes it easy to store when not in use. Ideal for both residential and commercial use, the Karcher S4 Push Sweeper is your go-to solution for maintaining clean and tidy outdoor spaces.",89.99,,active,,Karcher,1909467,,,Alex MacDonald,alex.macdonald@treasurehub.club,Home Goods,Cleaning Supplies,9,22,28,,0,0,6,Sun Sep 21 2025 11:20:24 GMT-0500 (Central Daylight Time),Sat Oct 11 2025 19:09:44 GMT-0500 (Central Daylight Time),,
cmftwhl0b0017i804dgxx1cbf,KNAC3K,"CedarCraft Self-Watering Garden Planter by Dobi and Associates","The CedarCraft Self-Watering Garden Planter is a versatile and efficient solution for urban gardening. Designed by Dobi and Associates Inc, this planter allows you to grow a variety of plants with minimal maintenance. Its self-watering feature ensures that your plants receive the right amount of water, reducing the need for frequent watering. Ideal for patios, balconies, or any outdoor space, this planter is crafted from high-quality materials to withstand the elements and provide a long-lasting gardening solution.",99.99,,active,,Dobi and Associates Inc,1759323,,,Alex MacDonald,alex.macdonald@treasurehub.club,Garden & Outdoor,Garden Tools,30,48,22,,0,0,8,Sun Sep 21 2025 11:17:12 GMT-0500 (Central Daylight Time),Tue Oct 14 2025 14:06:31 GMT-0500 (Central Daylight Time),,
cmftwbpje0019l504985d4kkx,GLYEMZ,"FLEXTREME 100' Hose by US Wire and Cable Corp","The FLEXTREME 100' Hose by US Wire and Cable Corp is a durable and flexible garden hose designed to meet all your watering needs. With its vibrant green color, this hose not only stands out but also offers excellent performance in various weather conditions. Made from high-quality materials, it ensures long-lasting use and reliability. Whether you're watering your garden, washing your car, or cleaning outdoor spaces, this hose is an essential tool for any homeowner.",14.99,,sold,,US Wire and Cable Corp,1876325,,,Alex MacDonald,alex.macdonald@treasurehub.club,Garden & Outdoor,Garden Tools,1,1,1200,,0,0,5,Sun Sep 21 2025 11:12:38 GMT-0500 (Central Daylight Time),Mon Oct 06 2025 01:13:54 GMT-0500 (Central Daylight Time),,
cmftw8vy00005l804t5j4qk1c,SWXJJ3,"Winix 4-Stage Air Purifier - Efficient Home Air Cleaner","The Winix 4-Stage Air Purifier is a highly efficient small appliance designed to improve the air quality in your home. Manufactured by Winix America Inc, this air purifier features a comprehensive 4-stage filtration system that effectively captures dust, pollen, smoke, odors, and other airborne pollutants. Ideal for those with allergies or asthma, it ensures a cleaner, healthier living environment. With its sleek design, it seamlessly blends into any room decor while providing powerful air purification. The unit is easy to operate and maintain, making it a practical choice for households seeking improved air quality.",95,,active,,Winix,2449587,,,Alex MacDonald,alex.macdonald@treasurehub.club,Home Goods,Appliances,21.5,13.7,9,,0,0,6,Sun Sep 21 2025 11:10:26 GMT-0500 (Central Daylight Time),Sat Oct 18 2025 10:53:40 GMT-0500 (Central Daylight Time),,
cmftw2myc0012l504muo1iqz0,UZWMHZ,"Flextreme 100' Garden Hose by US Wire and Cable Corp","The Flextreme 100' Garden Hose by US Wire and Cable Corp is a durable and flexible solution for all your gardening needs. Designed to withstand various weather conditions, this hose is perfect for watering your garden, washing your car, or any other outdoor task. Its vibrant green color ensures visibility, while its robust construction guarantees longevity. With a length of 100 feet, it provides ample reach for large areas, making it a versatile addition to your gardening toolkit.",14.99,,sold,,US Wire and Cable Corp,1876325,,,Alex MacDonald,alex.macdonald@treasurehub.club,Garden & Outdoor,Garden Tools,1,1,1200,,0,0,4,Sun Sep 21 2025 11:05:35 GMT-0500 (Central Daylight Time),Thu Oct 16 2025 21:05:44 GMT-0500 (Central Daylight Time),,
cmftvvzpn0010i804uju39qk2,8GB72U,"Golden Select 12x12 Deck Tiles by J Sonic Services Inc","Enhance your outdoor space with the Golden Select 12x12 Deck Tiles by J Sonic Services Inc. These high-quality deck tiles are perfect for creating a stylish and durable outdoor flooring solution. Made from premium materials, they are designed to withstand the elements and provide a long-lasting finish. Ideal for patios, balconies, and garden areas, these tiles offer a simple and efficient way to upgrade your outdoor living space. With their easy installation process, you can transform your area with minimal effort. The tiles are designed to interlock, ensuring a secure and stable fit. Whether you're looking to refresh your existing deck or create a new one, these tiles are a versatile and practical choice.",19.99,,active,,J Sonic Services Inc,1791218,,,Alex MacDonald,alex.macdonald@treasurehub.club,Home Improvement Supplies,Building Materials,12,12,.8,,0,0,6,Sun Sep 21 2025 11:00:24 GMT-0500 (Central Daylight Time),Tue Oct 14 2025 20:08:38 GMT-0500 (Central Daylight Time),,
cmftvntj6000vl504ywzpqk0c,IB6PIY,"Bon Aire Ultimate Water Blaster","Introducing the Bon Aire Ultimate Water Blaster, a versatile and powerful tool designed for all your gardening and outdoor cleaning needs. This water blaster, manufactured by Bon Aire, is known for its durability and efficiency. Perfect for tackling tough dirt and grime, it offers a reliable solution for maintaining your outdoor spaces. Whether you're washing your car, cleaning your patio, or watering your garden, this water blaster is up to the task. With its ergonomic design and easy-to-use features, it ensures a comfortable and effective cleaning experience.",14.99,,active,,Bon Aire,1679840,,,Alex MacDonald,alex.macdonald@treasurehub.club,Garden & Outdoor,Garden Tools,45,1,1,,0,0,5,Sun Sep 21 2025 10:54:03 GMT-0500 (Central Daylight Time),Fri Oct 17 2025 17:20:00 GMT-0500 (Central Daylight Time),,
cmftvjvzc000vi804k9dt1a4l,OKFUAY,"Bon Aire Ultimate Water Blaster","The Bon Aire Ultimate Water Blaster is a top-tier gardening tool designed for efficiency and durability. This water blaster is in excellent condition, showcasing minimal signs of use, ensuring it performs as if brand new. Ideal for various gardening tasks, it offers powerful water pressure to tackle even the toughest dirt and grime. Its ergonomic design ensures comfortable handling, making it a must-have for gardening enthusiasts.",14.99,,active,,Bon Aire,,,,Alex MacDonald,alex.macdonald@treasurehub.club,Garden & Outdoor,Garden Tools,45,1,1,,0,0,5,Sun Sep 21 2025 10:51:00 GMT-0500 (Central Daylight Time),Sat Oct 18 2025 11:44:04 GMT-0500 (Central Daylight Time),,
cmftv7uy3000ol504zs5i1ej3,X10D0A,"Teknor Apex Rapid Flo Garden Hose","Introducing the Teknor Apex Rapid Flo Garden Hose, a durable and flexible solution for all your gardening needs. This high-quality garden hose is designed by the renowned Teknor Apex Company, ensuring reliability and performance. Ideal for both residential and commercial use, the Rapid Flo Garden Hose is lightweight yet robust, making it easy to maneuver around your garden. With its kink-resistant design, you can enjoy uninterrupted water flow, making watering your plants or washing your car a breeze. The hose is constructed with premium materials to withstand various weather conditions, ensuring longevity and durability. Whether you're a gardening enthusiast or a professional landscaper, this garden hose is an essential tool for maintaining a lush and vibrant garden.",34.99,,active,,Teknor Apex,,,,Alex MacDonald,alex.macdonald@treasurehub.club,Garden & Outdoor,Garden Tools,1,1,1200,,0,0,8,Sun Sep 21 2025 10:41:39 GMT-0500 (Central Daylight Time),Mon Nov 03 2025 13:08:29 GMT-0600 (Central Standard Time),,
